<?xml version="1.0"?>

<restricciones xmlns:xsi="http://www.w3.org/2001/XMLSchema-instance" 
xsi:noNamespaceSchemaLocation="restricciones.xsd">
    <persona>
        <nombre></nombre>
        <apellidos></apellidos>
    </persona>
    <empresa>
        <empleado>Juan</empleado>
    </empresa>
    <edad>5</edad>
    <coche>Audi</coche>
    <semana>Lunes</semana>
    <letras>aBh</letras>
    <telefono>938347549</telefono>
    <curso>aA</curso>
    <genero>male</genero>
    <password>2736456A</password>
</restricciones>